{
  "assets": [],
  "distribution_digest": "31709f7f7c178fb6b6bf086ab6f23d672acc833de4d7b759f7aea56e45a1c3ba",
  "engine_version_range": ">=2.4.0 <3.0.0",
  "extensions": {
    "textile": {
      "candidate_compilation_only": false,
      "generic_connector_query_enabled": true,
      "generic_external_operation_enabled": false
    }
  },
  "manifest_schema_version": "1.0",
  "pack_id": "legacy_fibrecheck.v1-compat",
  "pack_version": "1.3.0",
  "provides": {
    "capabilities": [
      {
        "capability_id": "legacy_fibrecheck.operation-metadata",
        "version": "1.0.0"
      },
      {
        "capability_id": "legacy_fibrecheck.task-snapshot-query",
        "version": "1.0.0"
      }
    ],
    "connectors": [
      {
        "connector_id": "legacy_fibrecheck",
        "operations": [
          {
            "completion_stage": "main_record_verified",
            "contract_version": 1,
            "execution_kind": "external_side_effect",
            "operation": "regenerated_fiber.count_upload",
            "side_effect_class": "external_write",
            "stages": [
              "authenticated",
              "permission_verified",
              "remote_absence_verified",
              "file_copy_ready",
              "file_copy_started",
              "file_copy_verified",
              "main_record_save_started",
              "main_record_verified",
              "completed"
            ],
            "write_boundary": "file_copy_started"
          },
          {
            "completion_stage": "main_record_verified",
            "contract_version": 1,
            "execution_kind": "external_side_effect",
            "extensions": {
              "textile": {
                "picture_count": 0,
                "picture_records": []
              }
            },
            "operation": "special_wool.image_upload",
            "side_effect_class": "external_write",
            "stages": [
              "authenticated",
              "permission_verified",
              "remote_state_verified",
              "task_project_verified",
              "file_copy_ready",
              "file_copy_started",
              "file_copy_verified",
              "main_record_save_started",
              "main_record_verified",
              "completed"
            ],
            "write_boundary": "file_copy_started"
          },
          {
            "completion_stage": "review_children_verified",
            "contract_version": 1,
            "execution_kind": "external_side_effect",
            "extensions": {
              "textile": {
                "picture_count": 0
              }
            },
            "operation": "special_wool.image_review",
            "side_effect_class": "external_write",
            "stages": [
              "authenticated",
              "permission_verified",
              "remote_state_verified",
              "review_save_ready",
              "review_save_started",
              "review_main_verified",
              "review_children_verified",
              "completed"
            ],
            "write_boundary": "review_save_started"
          },
          {
            "completion_stage": "excel_proof_verified",
            "contract_version": 1,
            "execution_kind": "external_side_effect",
            "operation": "microscopy.check_record_entry",
            "side_effect_class": "external_write",
            "stages": [
              "authenticated",
              "permission_verified",
              "remote_state_verified",
              "excel_write_ready",
              "excel_collection_started",
              "remote_file_verified",
              "excel_register_verified",
              "excel_proof_verified",
              "completed"
            ],
            "write_boundary": "excel_collection_started"
          },
          {
            "completion_stage": "main_record_verified",
            "contract_version": 1,
            "execution_kind": "external_side_effect",
            "extensions": {
              "textile": {
                "picture_count": 0
              }
            },
            "operation": "paper_fiber.qualitative_upload",
            "side_effect_class": "external_write",
            "stages": [
              "authenticated",
              "permission_verified",
              "remote_state_verified",
              "task_project_verified",
              "file_copy_ready",
              "file_copy_started",
              "file_copy_verified",
              "main_record_save_started",
              "main_record_verified",
              "completed"
            ],
            "write_boundary": "file_copy_started"
          },
          {
            "completion_stage": "review_main_verified",
            "contract_version": 1,
            "execution_kind": "external_side_effect",
            "extensions": {
              "textile": {
                "picture_count": 0
              }
            },
            "operation": "paper_fiber.qualitative_review",
            "side_effect_class": "external_write",
            "stages": [
              "authenticated",
              "permission_verified",
              "remote_state_verified",
              "review_save_ready",
              "review_save_started",
              "review_main_verified",
              "completed"
            ],
            "write_boundary": "review_save_started"
          },
          {
            "completion_stage": "generic_projection_verified",
            "contract_version": 1,
            "execution_kind": "external_side_effect",
            "input_schema": {
              "additionalProperties": false,
              "properties": {
                "expected_existing_register_count": {
                  "minimum": 0,
                  "type": "integer"
                },
                "inspection_number": {
                  "maxLength": 100,
                  "minLength": 1,
                  "pattern": "^[A-Za-z0-9-]+$",
                  "type": "string"
                },
                "judge_basis": {
                  "maxLength": 2000,
                  "type": "string"
                },
                "judgement": {
                  "maxLength": 2000,
                  "type": "string"
                },
                "project_key": {
                  "pattern": "^task-project:[a-f0-9]{24}$",
                  "type": "string"
                },
                "result_value": {
                  "maxLength": 4000,
                  "minLength": 1,
                  "pattern": "\\S",
                  "type": "string"
                },
                "sample_identity": {
                  "maxLength": 2000,
                  "type": "string"
                },
                "standard_value": {
                  "maxLength": 2000,
                  "type": "string"
                },
                "unit": {
                  "enum": [
                    "",
                    "%"
                  ]
                }
              },
              "required": [
                "inspection_number",
                "project_key",
                "expected_existing_register_count",
                "result_value"
              ],
              "type": "object"
            },
            "operation": "check_record.generic_entry",
            "side_effect_class": "external_write",
            "stages": [
              "authenticated",
              "permission_verified",
              "remote_state_verified",
              "generic_write_ready",
              "generic_save_started",
              "generic_rows_verified",
              "generic_projection_verified",
              "completed"
            ],
            "write_boundary": "generic_save_started"
          }
        ],
        "queries": [
          {
            "consistency": "cached",
            "contract_version": 1,
            "execution_kind": "automatic",
            "input_schema": {
              "additionalProperties": false,
              "properties": {
                "inspection_number": {
                  "maxLength": 200,
                  "minLength": 1,
                  "type": "string"
                },
                "refresh": {
                  "default": false,
                  "type": "boolean"
                }
              },
              "required": [
                "inspection_number"
              ],
              "type": "object"
            },
            "name": "读取检务任务快照",
            "output_schema": {
              "additionalProperties": false,
              "properties": {
                "cache_state": {
                  "enum": [
                    "empty",
                    "incomplete_number",
                    "ready",
                    "stale",
                    "stale_error",
                    "pending",
                    "failed"
                  ]
                },
                "error_code": {
                  "type": [
                    "string",
                    "null"
                  ]
                },
                "expires_at": {
                  "type": [
                    "string",
                    "null"
                  ]
                },
                "fetched_at": {
                  "type": [
                    "string",
                    "null"
                  ]
                },
                "inspection_number": {
                  "type": "string"
                },
                "refresh_status": {
                  "enum": [
                    "idle",
                    "queued",
                    "running",
                    "ready",
                    "failed"
                  ]
                },
                "revision": {
                  "minimum": 1,
                  "type": [
                    "integer",
                    "null"
                  ]
                },
                "snapshot": {